{
  "as_of": "2026-10-10T23:59:59Z",
  "blocks": [
    {
      "commitment_count": 4,
      "control_roles": {
        "watch_commitment": 4
      },
      "horizon_days": 30,
      "not_evaluable_count": 0,
      "open_count": 0,
      "public_group_id": "bdbv-2026-public-calibration-2026-05-20",
      "public_value_tiers": {
        "registered_watch": 4
      },
      "registered_at": "2026-05-20",
      "remaining_days_from_snapshot_as_of": -113,
      "resolution_date": "2026-06-19",
      "resolved_count": 4,
      "status": "resolved"
    },
    {
      "commitment_count": 8,
      "control_roles": {
        "blindspot_watch": 1,
        "likely_negative": 2,
        "likely_positive": 3,
        "watchlist_high": 1,
        "watchlist_mid": 1
      },
      "horizon_days": 30,
      "not_evaluable_count": 0,
      "open_count": 0,
      "public_group_id": "bdbv-2026-public-calibration-2026-05-21",
      "public_value_tiers": {
        "relative_high": 2,
        "relative_low": 2,
        "relative_mid": 4
      },
      "registered_at": "2026-05-21",
      "remaining_days_from_snapshot_as_of": -112,
      "resolution_date": "2026-06-20",
      "resolved_count": 8,
      "status": "resolved"
    },
    {
      "commitment_count": 3,
      "control_roles": {
        "watchlist_high": 1,
        "watchlist_mid": 2
      },
      "horizon_days": 30,
      "not_evaluable_count": 0,
      "open_count": 0,
      "public_group_id": "bdbv-2026-public-calibration-2026-05-26",
      "public_value_tiers": {
        "relative_high": 1,
        "relative_mid": 2
      },
      "registered_at": "2026-05-26",
      "remaining_days_from_snapshot_as_of": -107,
      "resolution_date": "2026-06-25",
      "resolved_count": 3,
      "status": "resolved"
    },
    {
      "commitment_count": 4,
      "control_roles": {
        "blindspot_watch": 1,
        "watchlist_mid": 3
      },
      "first_published_at": "2026-06-12",
      "horizon_days": 30,
      "not_evaluable_count": 0,
      "open_count": 0,
      "public_group_id": "bdbv-2026-public-calibration-2026-06-04",
      "public_value_tiers": {
        "relative_high": 2,
        "relative_low": 1,
        "relative_mid": 1
      },
      "registered_at": "2026-06-04",
      "remaining_days_from_snapshot_as_of": -98,
      "resolution_date": "2026-07-04",
      "resolved_count": 4,
      "status": "resolved"
    },
    {
      "commitment_count": 41,
      "control_roles": {
        "alert_to_lab_latency_hold": 1,
        "cfr_severity_persistence": 1,
        "contact_followup_rate_hold_vs_degrade": 1,
        "containment_absence_commitment": 1,
        "corridor_watch_commitment": 2,
        "count_increment_commitment": 1,
        "death_velocity_deceleration": 1,
        "detection_lead_single_zone": 1,
        "detection_precedes_confirmation_ordering": 1,
        "detection_rank_consistency": 1,
        "first_conversion_tripwire": 1,
        "geographic_expansion_commitment": 2,
        "importation_classification_commitment": 1,
        "interprovincial_cfr_convergence": 1,
        "isolation_bed_occupancy_direction": 1,
        "land_hold_border_district": 4,
        "latency_observatory_new_edition": 1,
        "magnitude_hold_commitment": 1,
        "national_death_toll_threshold": 1,
        "north_kivu_death_threshold": 1,
        "north_kivu_incremental_death_share": 1,
        "onset_to_isolation_delay_shortens": 1,
        "point_of_care_assay_field_deployment": 1,
        "positivity_flat_while_testing_rises": 1,
        "response_posture_commitment": 2,
        "ring_vaccination_new_zone_expansion": 1,
        "rwanda_border_zero_hold": 1,
        "south_kivu_front_escalation": 1,
        "spatial_extent_named": 1,
        "spatial_extent_open": 1,
        "spatial_ordinal_pairwise": 2,
        "uganda_local_acquired_share": 1,
        "uganda_national_magnitude": 1,
        "uganda_new_confirmed_rate": 1
      },
      "horizon_days": 30,
      "not_evaluable_count": 2,
      "open_count": 0,
      "public_group_id": "bdbv-2026-public-calibration-2026-07-05",
      "public_value_tiers": {
        "direction:down": 3,
        "direction:hold": 15,
        "direction:up": 3,
        "relative_high": 2,
        "relative_low": 1,
        "relative_mid": 5,
        "threshold:<=1": 1,
        "threshold:<=2": 1,
        "threshold:<=40": 1,
        "threshold:>=1": 4,
        "threshold:>=30": 1,
        "threshold:>=6": 1,
        "threshold:>=7": 1,
        "threshold:>=700": 1,
        "threshold:>=80": 1
      },
      "registered_at": "2026-07-05",
      "remaining_days_from_snapshot_as_of": -67,
      "resolution_date": "2026-08-04",
      "resolved_count": 39,
      "status": "resolved"
    },
    {
      "commitment_count": 31,
      "control_roles": {
        "low_band_bias_test": 4,
        "model_saturation_test": 6,
        "operational_capacity": 10,
        "structural_method_comparison": 11
      },
      "first_published_at": "2026-09-17",
      "horizon_days": 30,
      "not_evaluable_count": 0,
      "open_count": 0,
      "public_group_id": "bdbv-2026-public-calibration-2026-09-01",
      "public_value_tiers": {
        "cadence:no_gap_over_2d": 1,
        "event:any_day<=0": 1,
        "saturated": 6,
        "sustained7:<=80": 1,
        "threshold:<=12": 1,
        "threshold:<=30": 1,
        "threshold:<=50": 1,
        "threshold:<=60": 1,
        "threshold:<=70": 1,
        "threshold:<=75": 1,
        "threshold:<=850": 1,
        "threshold:>=100": 1,
        "threshold:>=1000": 1,
        "threshold:>=1700": 1,
        "threshold:>=1900": 1,
        "threshold:>=2": 1,
        "threshold:>=20": 1,
        "threshold:>=2000": 1,
        "threshold:>=2200": 1,
        "threshold:>=280": 1,
        "threshold:>=29_reports": 1,
        "threshold:>=300": 1,
        "threshold:>=600": 1,
        "threshold:>=70": 1,
        "threshold:>=700": 1,
        "threshold:any>=4": 1
      },
      "registered_at": "2026-09-01",
      "remaining_days_from_snapshot_as_of": -9,
      "resolution_date": "2026-10-01",
      "resolved_count": 31,
      "status": "resolved"
    },
    {
      "commitment_count": 133,
      "control_roles": {
        "feed_continuity": 2,
        "low_count_falsification_test": 5,
        "method_comparison_challenger": 63,
        "method_comparison_incumbent": 63
      },
      "first_published_at": "2026-10-04",
      "horizon_days": 31,
      "not_evaluable_count": 0,
      "open_count": 133,
      "public_group_id": "bdbv-2026-public-calibration-2026-10-04",
      "public_value_tiers": {
        "cadence:no_gap_over_1d": 1,
        "event:any_day<=0": 1,
        "event:any_day<=15": 1,
        "event:any_day<=30": 1,
        "event:any_day<=45": 1,
        "event:any_day<=60": 1,
        "threshold:<=0": 2,
        "threshold:<=1": 2,
        "threshold:<=10": 2,
        "threshold:<=10000": 2,
        "threshold:<=10300": 2,
        "threshold:<=10450": 2,
        "threshold:<=10550": 2,
        "threshold:<=10700": 2,
        "threshold:<=1125": 2,
        "threshold:<=125": 2,
        "threshold:<=15": 2,
        "threshold:<=17": 2,
        "threshold:<=1800": 2,
        "threshold:<=2": 2,
        "threshold:<=20": 2,
        "threshold:<=2000": 2,
        "threshold:<=2400": 2,
        "threshold:<=25": 2,
        "threshold:<=2700": 2,
        "threshold:<=2800": 4,
        "threshold:<=2900": 2,
        "threshold:<=2950": 2,
        "threshold:<=3": 2,
        "threshold:<=30": 4,
        "threshold:<=300": 2,
        "threshold:<=330": 2,
        "threshold:<=35": 2,
        "threshold:<=37": 2,
        "threshold:<=370": 2,
        "threshold:<=3700": 2,
        "threshold:<=375": 2,
        "threshold:<=380": 2,
        "threshold:<=450": 4,
        "threshold:<=4925": 2,
        "threshold:<=500": 2,
        "threshold:<=5025": 2,
        "threshold:<=5075": 2,
        "threshold:<=5150": 2,
        "threshold:<=5250": 2,
        "threshold:<=540": 2,
        "threshold:<=55": 4,
        "threshold:<=65": 4,
        "threshold:<=66": 2,
        "threshold:<=68": 4,
        "threshold:<=700": 2,
        "threshold:<=72": 2,
        "threshold:<=77": 2,
        "threshold:<=775": 2,
        "threshold:<=79": 2,
        "threshold:<=80": 2,
        "threshold:<=82": 2,
        "threshold:<=850": 2,
        "threshold:<=88": 2,
        "threshold:<=9": 2,
        "threshold:<=900": 2,
        "threshold:<=95": 2,
        "threshold:<=950": 2,
        "threshold:>=26_reports": 1
      },
      "registered_at": "2026-10-04",
      "remaining_days_from_snapshot_as_of": 22,
      "resolution_date": "2026-11-01",
      "resolved_count": 0,
      "status": "awaiting_resolution"
    },
    {
      "commitment_count": 9,
      "control_roles": {
        "method_comparison_challenger": 4,
        "method_comparison_incumbent": 4,
        "onward_transmission_test": 1
      },
      "first_published_at": "2026-10-07",
      "horizon_days": 28,
      "not_evaluable_count": 0,
      "open_count": 9,
      "public_group_id": "bdbv-2026-public-calibration-2026-10-07",
      "public_value_tiers": {
        "event:>=1_report": 9
      },
      "registered_at": "2026-10-07",
      "remaining_days_from_snapshot_as_of": 25,
      "resolution_date": "2026-11-04",
      "resolved_count": 0,
      "status": "awaiting_resolution"
    }
  ],
  "ledger_rows": 233,
  "next_resolution_date": "2026-11-01",
  "not_evaluable_commitments": 2,
  "open_commitments": 142,
  "outbreak_id": "bdbv-uga-cod-2026",
  "resolved_commitments": 89,
  "resolver_caveats": [
    "Rows resolve only from public MOH, WHO, Africa CDC, CDC, ECDC, INRB, or cited public authority reporting.",
    "Ambiguous or unavailable public evidence remains open until documented review.",
    "This public status surface is read-only; it does not mutate ledger rows or resolution outcomes."
  ],
  "schema_version": "1.0",
  "snapshot_date": "2026-10-10",